{"$id":"ai/verification-gate-result.json","$schema":"ai/schemas/verification-gate-result.schema.json","data":{"changeType":"critical-data","checks":[{"checkId":"native-runtime-adapter","commitSha":"d5ed386a3f35b717f3d3c971d13c3148a7efe7f9","evidenceRef":"ai/native-runtime-adapters.json","leafResultRef":"ai/native-adapter-result.json","leafResultSha256":"b82855e8f9e27a9e5746433c00470e2987b263b1ce9e99200b5afc5d3b25eab7","mappedResult":"NOT_APPLICABLE","policySha256":"0192c4853f72183f9dffee972098b8fd8aec11dae8a7af31708f22136a6b1c94","producerId":"native-runtime-adapter","rawResult":"NOT_APPLICABLE","reason":"HOST_UNSUPPORTED","required":true},{"checkId":"verify.unit","commitSha":"d5ed386a3f35b717f3d3c971d13c3148a7efe7f9","evidenceRef":".ai-runs/verify-20260716-level5-completion-unit-01/commands/verify.unit/b5979ebd-edb9-4690-b276-e5f63d08ade2.json","leafResultRef":"ai/work-logs/issue-20/phase2c/verify-unit-leaf.json","leafResultSha256":"b893dad6aac7745055ad9c51e845728ad46c760f2dfbfd547c264fb69acb2dc7","mappedResult":"PASS","policySha256":"0192c4853f72183f9dffee972098b8fd8aec11dae8a7af31708f22136a6b1c94","producerId":"verify.unit","rawResult":"PASS","reason":null,"required":true},{"checkId":"verify.integration","commitSha":"d5ed386a3f35b717f3d3c971d13c3148a7efe7f9","evidenceRef":".ai-runs/verify-20260716-level5-completion-integration-01/commands/verify.integration/f770b516-e628-44a6-997c-86624b138525.json","leafResultRef":"ai/work-logs/issue-20/phase2c/verify-integration-leaf.json","leafResultSha256":"1b59c94dc790e71c92144ee5e75b62e13fa3aa4493dc8402e7e4770fc297aa07","mappedResult":"PASS","policySha256":"0192c4853f72183f9dffee972098b8fd8aec11dae8a7af31708f22136a6b1c94","producerId":"verify.integration","rawResult":"PASS","reason":null,"required":true},{"checkId":"verify.api-smoke","commitSha":"d5ed386a3f35b717f3d3c971d13c3148a7efe7f9","evidenceRef":".ai-runs/verify-20260716-level5-completion-api-smoke-01/commands/verify.api-smoke/44a4b537-95aa-47d0-8dac-4595af33e716.json","leafResultRef":"ai/work-logs/issue-20/phase2c/verify-api-smoke-leaf.json","leafResultSha256":"106ec1605e4f1954a864ea1a71226e0af5fe518ec222059085c6ca67d9a20243","mappedResult":"PASS","policySha256":"0192c4853f72183f9dffee972098b8fd8aec11dae8a7af31708f22136a6b1c94","producerId":"verify.api-smoke","rawResult":"PASS","reason":null,"required":true},{"checkId":"verify.e2e","commitSha":"d5ed386a3f35b717f3d3c971d13c3148a7efe7f9","evidenceRef":".ai-runs/verify-20260716-level5-completion-e2e-01/commands/verify.e2e/9306ea40-771b-4081-8ce7-55fb995f28b9.json","leafResultRef":"ai/work-logs/issue-20/phase2c/verify-e2e-leaf.json","leafResultSha256":"28ceb020f627503f0d17db075eca8bd821b6b15df938bb8cef76b09a4b36209b","mappedResult":"PASS","policySha256":"0192c4853f72183f9dffee972098b8fd8aec11dae8a7af31708f22136a6b1c94","producerId":"verify.e2e","rawResult":"PASS","reason":null,"required":true},{"checkId":"review-gate","commitSha":"d5ed386a3f35b717f3d3c971d13c3148a7efe7f9","evidenceRef":".ai-runs/verify-20260716-level5-completion-build-01/gate-results/pre-done-claim.json","leafResultRef":"ai/work-logs/issue-20/phase2c/review-gate-leaf.json","leafResultSha256":"a6cfcff84e93c4ceb0600a8c633efae0b2b0d514af88fc4054322889daa11b56","mappedResult":"PASS","policySha256":"0192c4853f72183f9dffee972098b8fd8aec11dae8a7af31708f22136a6b1c94","producerId":"review-gate","rawResult":"PASS","reason":null,"required":true},{"checkId":"done-claim-gate","commitSha":"d5ed386a3f35b717f3d3c971d13c3148a7efe7f9","evidenceRef":".ai-runs/verify-20260716-level5-completion-e2e-01/gate-results/pre-done-claim.json","leafResultRef":"ai/work-logs/issue-20/phase2c/done-claim-gate-leaf.json","leafResultSha256":"019f9a502c05c8411b4fea654346776b43a9a9194fbf77ffae5ce54a4368efbe","mappedResult":"PASS","policySha256":"0192c4853f72183f9dffee972098b8fd8aec11dae8a7af31708f22136a6b1c94","producerId":"done-claim-gate","rawResult":"PASS","reason":null,"required":true},{"checkId":"verify.static","commitSha":null,"evidenceRef":null,"leafResultRef":null,"leafResultSha256":null,"mappedResult":"NOT_APPLICABLE","policySha256":null,"producerId":null,"rawResult":"NOT_CONFIGURED","reason":"No verified leaf evidence was provided for this check.","required":false},{"checkId":"failure-triage","commitSha":null,"evidenceRef":null,"leafResultRef":null,"leafResultSha256":null,"mappedResult":"NOT_APPLICABLE","policySha256":null,"producerId":null,"rawResult":"NOT_CONFIGURED","reason":"No verified leaf evidence was provided for this check.","required":false}],"completenessEvaluated":true,"createdAiRuns":false,"entryPoint":"api-smoke","minimumVerificationLevel":5},"errors":[],"operation":"VERIFICATION_GATE","reason":"REPOSITORY_ONLY_HOST_UNSUPPORTED","result":"PASS","schemaVersion":1}
